<?xml version="1.0" encoding="utf-8"?>
<settings xmlns:xsi="http://www.w3.org/2001/XMLSchema-instance" xmlns="urn:rhena:settings" xsi:schemaLocation="urn:rhena:settings http://schema.unnsvc.com/rhena/settings.xsd">
	<repositories>
		<workspace>
			<repository location="file:/home/$USER/noname/.rhena/repository" />
		</workspace>
		<cache>
			<repository location="file:/path" />
		</cache>
		<remote>
			<repository location="http://some/location" />
		</remote>
	</repositories>
</settings>
